{
  "$schema": "https://json-schema.org/draft/2020-12/schema",
  "title": "music-video brief",
  "description": "Everything creative about one video, as data. run_brief.py turns it into a rendered cut. inputs/clamor_hold_the_line.brief.json is a filled example.",
  "type": "object",
  "required": ["name", "song", "style", "shots"],
  "properties": {
    "name": {"type": "string", "minLength": 1, "description": "run name: output folder and file stem"},
    "song": {
      "type": "object", "required": ["name", "seconds", "bpm", "key", "tags", "lyrics"],
      "properties": {
        "name": {"type": "string"}, "seconds": {"type": "number", "exclusiveMinimum": 0},
        "bpm": {"type": "integer"}, "key": {"type": "string"},
        "tags": {"type": "string", "description": "genre -> instruments -> mood -> vocal character; no artist or song names"},
        "lyrics": {"type": "string", "description": "original lyrics with [verse]/[chorus] section tags; one sung line per line"}
      }
    },
    "style": {"type": "string", "description": "appended to every still prompt so the shots share a look"},
    "shots": {
      "type": "array", "minItems": 1,
      "items": {
        "type": "object", "required": ["lines", "kind"],
        "properties": {
          "lines": {"type": "integer", "minimum": 1, "description": "how many lyric lines this shot covers; the sum over shots must equal the lyric line count"},
          "kind": {"enum": ["still", "kenburns", "video"]},
          "prompt": {"type": "string", "description": "still/kenburns: the image prompt (style is appended)"},
          "kb": {"type": "object", "properties": {"zoom": {"enum": ["in", "out", "none"]}, "pan": {"enum": ["c", "l", "r", "u", "d"]}}},
          "motion": {"type": "string", "description": "video: the Wan motion prompt (what changes, gentle verbs)"},
          "source_shot": {"type": "integer", "minimum": 0, "description": "video: index of the still shot whose chosen still starts the clip; must not be adjacent to this shot"}
        }
      }
    },
    "loop": {
      "type": "object", "required": ["length"],
      "properties": {"length": {"type": "number"}, "crossfade": {"type": "number"}, "search": {"type": "number"}, "blend_at": {"enum": ["start", "end"]}}
    },
    "candidates": {
      "type": "object",
      "properties": {
        "song_seeds": {"type": "array", "items": {"type": "integer"}},
        "stills_n": {"type": "integer", "minimum": 1, "maximum": 26},
        "clips_n": {"type": "integer", "minimum": 1, "maximum": 4},
        "seed_base_stills": {"type": "integer"}, "seed_base_clips": {"type": "integer"}
      }
    }
  }
}
